### ISSUE TITLE
tuspyserver fails on streams: The real ones, not those fakes from tuspy

### ISSUE THREAD

**Issue by volkerjaenisch** [edihasaj/tuspyserver#71]
Dear Edi!

It looks like tuspyserver is broken handling streams.

Please have a look at 

https://github.com/volkerjaenisch/tuspyserver_test

which is a simple poetry env. Please follow the README.md.

You will see:

The code utilizing tuspy aka tuspy-client.py will run, my code simple_client.py will not.

Tuspy-client.py runs since tuspy cheats and reads the stream in the client completely and then pushes it in one large chunk.

My code is quite more subtle. It just follows the TUS.io protocol. It uses the stream and sends up chunks of 5MB. 

And there your code fails. The first PATCH request runs trough but the second will stuck.

The reason for this I already made out:

                    # Check if upload would exceed declared size
                    if (
                        new_params.size is not None
                        and new_params.offset + len(chunk) > new_params.size
                    ):

Here you are checking for  "new_params.size is not None" and this hold for the first request.
But in the second request "new_params.size" is "0" and the length checking fails.

My gut tells me that here something no good is happening.

```
def make_request_chunks_dep(options: TusRouterOptions):
    async def request_chunks_dep(
        request: Request,
        uuid: str = Path(...),
        post_request: bool = False,
    ) -> Optional[bool]:
        # init file handle
        file = TusUploadFile(uid=uuid, options=options)
```

You are building an instance of TusUploadFile in a dependency "make_request_chunks_dep" that reads the chunk for real. 
Then in the main endpoint you are building that instance again. This looks suspicious to me since it is prone to race conditions.

Sorry, that I do not have found your error - now it is your turn.

Cheers,
Volker

**Comment by volkerjaenisch** [comment]
This is the protocol breakdown with the puspy client:

sudo tcpdump -i lo -s 0 -A 'tcp port 8888 and (((tcp[((tcp[12:1] & 0xf0) >> 2):4]) = 0x50415443))'
tcpdump: verbose output suppressed, use -v[v]... for full protocol decode
listening on lo, link-type EN10MB (Ethernet), snapshot length 262144 bytes
02:41:51.059598 IP view-localhost.35048 > view-localhost.8888: Flags [P.], seq 3109051286:3109051585, ack 2138980012, win 512, options [nop,nop,TS val 4140960460 ecr 4140960460], length 299
E.._4.@.@............."..P[..~>......S.....
..
...
.PATCH /files/db4e1d05583f42b09bd4306446acf81b HTTP/1.1
Host: localhost:8888
User-Agent: python-requests/2.32.4
Accept-Encoding: gzip, deflate
Accept: */*
Connection: keep-alive
upload-offset: 0
Content-Type: application/offset+octet-stream
Tus-Resumable: 1.0.0
Content-Length: 629145600

There was one segment transmitted with 629145600 Bytes

Now my infamous Tuspy-client:

 sudo tcpdump -i lo -s 0 -A 'tcp port 8888 and (((tcp[((tcp[12:1] & 0xf0) >> 2):4]) = 0x50415443))'
[sudo] Passwort für volker: 
tcpdump: verbose output suppressed, use -v[v]... for full protocol decode
listening on lo, link-type EN10MB (Ethernet), snapshot length 262144 bytes
04:16:23.636986 IP view-localhost.55430 > view-localhost.8888: Flags [P.], seq 3780703470:3780703797, ack 2672084250, win 512, options [nop,nop,TS val 4146633038 ecr 4146633038], length 327
E..{..@.@.n..........."..X...D.......o.....
.(.N.(.NPATCH /files/b8baf6f72fa14fa795cec01a96c4bfe9 HTTP/1.1
Host: localhost:8888
User-Agent: python-requests/2.32.4
Accept-Encoding: gzip, deflate
Accept: */*
Connection: keep-alive
Tus-Resumable: 1.0.0
Upload-Offset: 0
Content-Type: application/offset+octet-stream
Cookie: access_token=bearer 
Content-Length: 5242880


04:16:26.053929 IP view-localhost.55442 > view-localhost.8888: Flags [P.], seq 3741108601:3741108934, ack 3173597502, win 512, options [nop,nop,TS val 4146635455 ecr 4146635455], length 333
E.....@.@.M..........."....y.)A>.....u.....
.(...(..PATCH /files/b8baf6f72fa14fa795cec01a96c4bfe9 HTTP/1.1
Host: localhost:8888
User-Agent: python-requests/2.32.4
Accept-Encoding: gzip, deflate
Accept: */*
Connection: keep-alive
Tus-Resumable: 1.0.0
Upload-Offset: 5242880
Content-Type: application/offset+octet-stream
Cookie: access_token=bearer 
Content-Length: 5242880

End after the second 5MB segment.

**Comment by edihasaj** [comment]
I'll have a look probably today

**Comment by edihasaj** [comment]
The Problem Flow:

  1. First PATCH request (5MB chunk at offset 0):
    - ✅ Dependency processes chunk, updates file.offset = 5242880
    - ✅ Main handler incorrectly sets size = 5242880 (should stay None for deferred)
    - ✅ Response: 204 No Content
  2. Second PATCH request (5MB chunk at offset 5242880):
    - ❌ Dependency validates: file.offset != upload_offset → 5242880 != 5242880 ✅ (passes)
    - ❌ Dependency processes chunk, updates file.offset = 10485760
    - ❌ Main handler validates AFTER processing: file.offset != upload_offset → 10485760 != 5242880 ❌
    - ❌ 409 Conflict Error

  The Root Causes:

  1. Double validation: Offset checked both in dependency AND main handler
  2. Wrong validation timing: Main handler checked offset AFTER dependency already processed chunks
  3. Incorrect deferred length logic: Setting size = upload_offset instead of waiting for Upload-Length header

  The Fix:

  1. Moved validation to dependency - check offset BEFORE processing chunks
  2. Fixed deferred length - only set size when client provides Upload-Length header
  3. Removed duplicate validation from main handler

these changes are in version 4.1.0
